topic,content
"• model of effects of ambience: Mehrabian and Russell’s pleasure-arousal-dominance (PAD) model.

• the effects of odour on shopper pleasure-arousal-dominance, including a study, e.g. Chebat and Michon
(2003).

• the effects of crowding on shopper pleasure-arousal-dominance, including a study, e.g. Machleit et al.
(2000) study 1 or study 2.","Retail atmospherics
The effect of ambience: the pleasurearousal-dominance (PAD) model
The pleasure-arousal-dominance model (PAD model)
was developed by Mehrabian and Russell (1974) to
demonstrate the way physical environments influence
people through their emotional impact. Mehrabian
and Russell proposed three dimensions of individuals'
emotions that influence their response to an environment:
pleasure, arousal and dominance. Pleasure relates to
the extent to which the consumer feels happy, content
or satisfied. Arousal relates to the extent to which the
consumer feels stimulated or excited. Dominance refers
to the person's feeling of being in control.
Donovan and Rossiter (1982, cited in Mehrabian &
Russell, 1974) applied this model to retail environments
and concluded that dominance wasn't significantly
relevant. They found, however, that pleasure and arousal
interact. If the ambience (atmosphere) of a shop leads to
an interaction of feelings of happiness and satisfaction
(pleasure) and excitement and stimulation (arousal) the
consumer is more likely to show 'approach' behaviours.
These 'approach' behaviours include the desire to enter
and explore the shop, to interact with staff and other
customers and to be satisfied with the environment.
However, if the ambience leads to feelings of
dissatisfaction and boredom, the consumer is more likely
to show 'avoidance' behaviour and choose not to spend
time and money in the shop. Approach behaviours of
course make a consumer more likely to make purchases
and become loyal customers who return in the future.
KEYWORDS
PAD model: a model designed to demonstrate
how physical environments influence people
through emotional impact: pleasure, arousal and
dominance
ambience: the atmosphere or 'feel' of a place,
often affected by sound, scent and sight
The effects of odour on shopper
pleasure-arousal-dominance
The background scent of an environment has become
more and more important in recent years; with
most retail environments using some sort of scent to
encourage customers in and to increase their sense of
satisfaction with their shopping experience. The scent
can range from simple air fresheners to advanced aroma
technology, and some companies (such as bakeries and
cafes) have released synthetic scents (artificial scents
of, e.g., baking and fresh coffee) to attract customers
(Hunter, 1995). 
Example study
Chebat and Michon (2003) investigated the influence of
ambient odours on mall shoppers and compared the
PAD model to a cognitive theory of emotions (Lazarus,
1991). A shopping mall in Canada was used in this
study; in the control week nothing was changed (there
was no ambient odour), and in the following week a
light, pleasing scent was diffused into the mall's main
corridor. A citrus scent was used as previous research
has suggested that citrus is an effectively pleasing scent
(Spangenberg et al., 1996). A sample of shoppers in each
week were asked to complete a questionnaire about their
shopping trip but were not told the purpose of the study.
As we have discussed, the PAD model suggests that
ambient odour would influence consumers' mood,
and therefore their approach/avoidance behaviours
through the interaction between pleasure and arousal.
In contrast, Lazarus' cognitive theory proposes that the
ambient odour is perceived by consumers, but that this
doesn't lead to a change in mood.
Chebat and Michon's study found that, although
ambient scent increased arousal in consumers, it did not
increase feelings of pleasure. It was found that pleasure
and arousal do not mediate the effects of environmental
cues on perceptions and behaviours. The findings did,
however, support the cognitive model: that a light and
pleasant ambient odour directly influenced consumers'
perception of the shopping environment and product
quality. Overall, this study has shown that a light and
pleasant background odour does have a positive effect
on consumers' perception of the shopping environment.
However, it does not support the PAD model, it instead
suggests that odour has a direct effect on perception
without an influence on mood.
The effects of crowding on shopper
pleasure-arousal-dominance
Crowding is just one of many physical aspects of a
shopping environment that has been shown to affect
the experience of the consumer. Perceived crowding
occurs when a person's demand for space is exceeded
by the supply (Stokols, 1972). Crowding will be
affected by anything that restricts the amount of space
a person requires or desires. Spatial crowding relates
to the number of physical objects, whereas human
crowding relates to the amount of people in a space (see
Figure 7.4). Research by Eroglu and Machleit (1990)
shows that perceived crowding can influence decisions
about where to shop, as well as satisfaction with
shopping experience.
7 Consumer psychology
KEYWORDS
spatial crowding: a person's demand for space
is not met due to the high number of physical
objects in a space
human crowding: a person's demand for space
is not met due to the high number of people
in a space
Figure 7 .4: Human crowding can affect a person's
satisfaction levels
Example study
Machleit et al. (2000) investigated how perceived crowding
influenced the shoppers' satisfaction, and whether this
relationship was moderated by emotions. A set of three
studies were carried out. There were two field experiments,
where samples of students and non-students were asked to
complete a questionnaire about their shopping experience
across a range of retail environments. There was one
laboratory experiment, where students were asked to
imagine they were going to a bookstore and then shown a
video clip of the store, with spatial and human crowding
density manipulated. Following this, they were asked to
complete a questionnaire about their thoughts, feelings and
perceptions of the bookstore.
The results of all three studies show that the effect of
crowding on shopping satisfaction is complex. Perceived
crowding, both in terms of spatial and human crowding,
lowers satisfaction, and this effect is greater for spatial
crowding.
In terms of the PAD model, the results of the two field
studies show that emotions can partially mediate the
effect of crowding on satisfaction. When pleasure and
245 ) 
) CAMBRIDGE INTERNATIONAL AS & A LEVEL PSYCHOLOGY: COURSEBOOK
arousal are included as mediating factors, the crowdingsatisfaction relationship (for both spatial and human
crowding) drops but is still significant. This means that
pleasure and arousal do appear to have some mediating
effect on the influence of crowding on satisfaction but
that there are other important factors as well, such as
expectation and tolerance.
KEYWORD
mediating factors: any variable or process that
affects the relationship between the stimulus and
the response
RESEARCH METHODS
Machleit et al.'s use of two field experiments
and one laboratory experiment is a good way of
investigating perceived crowding as it enabled
them to benefit from the strengths of both types
of experiments. There is usually a trade-off
between lab and field experiments in terms of
ecological validity and control. A field experiment
has high ecological validity and tells us about
how people behave in a real-life setting, which
is particularly important when investigating
something such as consumer behaviour as it
means we can generalise the findings more
confidently beyond the research setting. However,
the downside is that field experiments lack the
high level of control achieved by laboratory
experiments. By using both types of experiments,
Machleit et al. have been able to get the best of
both worlds, while understanding the weaknesses
of each experiment type.
ISSUES AND DEBATES
Cultural differences are relevant in this section
because it considers retail atmospherics. The
research focuses on the influence of odour in
a shopping mall and crowding across a range
of different shops in Canada and the USA. It is
important to consider the fact that these are two
large Western developed cultures where large
shopping malls and a wide range of different shops
are the norms, and where shopping is considered a
leisure activity, as well as part of daily life.
246)
CONTINUED
In some cultures, however, shopping malls would
not exist and any shops that were present would
be smaller and based on need rather than leisure.
Therefore, the findings of this research would not
be applicable to all cultures. "
"• wayfinding in shopping malls; factors affecting wayfinding such as signs and you are here maps,
including a study, e.g. Dogu and Erkip (2000).

• shopper behaviour focusing on spatial movement patterns including types of trip (short, round, central
and wave) and the five types of spatial behaviour patterns (specialist, native, tourist, explorer, raider); the
use of CCTV tracking, including a study, e.g. Gil et al. (2009).","7 .2 The psychological
environment
Environmental influences on
consumers
Wayfinding in shopping malls
Wayfinding refers to our ability to know where we are
and to plan a route to where we are going. Certain tools
can help us with wayfinding, for example to find our way
around a shopping mall, we may rely on maps and signs.
KEYWORD
wayfinding: refers to our ability to know where
we are and to plan a route to where we are
going. Certain tools can help us with wayfinding,
for example to find our way around a shopping
mall, we may rely on maps and signs 
Weisman (1981) identified four groups of environmental
variables that can help with wayfinding: visual cues or
landmarks within or outside of a building; architectural
differences between different parts of a building; the use
of signs and room numbers; building configuration. A
trip to a shopping mall is likely to involve visiting several
different shops and so the ease of which a consumer can
find their way around will have a direct impact on the
satisfaction they experience (Arthur & Passini, 1992).
KEYWORD
building configuration: the overall size and shape
of a building, and the way the building is laid out
Example study
Dogu and Erkip (2000) aimed to investigate how spatial
factors, such as signs and maps, could aid wayfinding
within a shopping mall. The case study was carried out
in a shopping mall in Ankara, Turkey, where the spatial
layout was analysed, and questionnaires were given
to shoppers. The shopping mall was categorised and
evaluated in terms of architecture, graphics and verbal
information. In terms of architecture, there is a central
atrium at the main entrance, with many shops leading off
the main corridor (see Figure 7.5). The layout is almost
symmetrical and there are three other entrances, and three
floors. There are circular corridors on each level, which
indicate the direction of travel. Elevators and escalators
connect the three floors. Graphic information all follows
the same consistent style and is almost all based on
pictographs rather than text (aside from 'WC' and 'Exit').
Door numbers are confusing; all shops on the ground
floor are numbered in the '1 00's but not all shops on the
second floor are in the 200s, nor are all shops on the third
floor in the 300s. Also, numbers are not all in order as
some shops were split later, so numbers have been added
later are out of order. This of course makes wayfinding
more difficult. The 'You Are Here' map and directory are
just across from the main entrance, but they sit parallel to
the direction of approach so are not very easy to see. The
KEYWORDS
pictographs: a way of providing information
using images only
bureaucratic hierarchy: decisions are made based
on who pays the most money; so, the businesses
that pay the most money will get the best spaces
7 Consumer psychology
directory is confusing and illogical, perhaps because it is
organised in a bureaucratic hierarchy (those who pay the
most money or are most important get the best spaces)
rather than in a way that logically helps with wayfinding.
In terms of verbal information, the information desk sits
prominently in the main atrium and security guards are
helpful when approached.
Questionnaires asked about participants' views of the
shopping mall in terms of wayfinding, focusing on all the
areas described previously. Results showed that, although
signage was not seen as more important than building
configuration for wayfinding, there was a significant
relationship between the evaluation of the shopping mall
for wayfinding and its signage system. Those who found
wayfinding easy found the signage to be significant, but
many didn't notice the signs and others found them
insufficient. Most respondents found 'You Are Here' maps
to be useful, but 47% didn't believe there were any in this
mall ( demonstrating that they are not placed in a very
visible or accessible way). There was a slight relationship
between door numbers and wayfinding, but none of the
architectural characteristics were significant for wayfinding.
The researchers concluded that the most important feature
that helped with wayfinding was signage. Other features,
such as building configuration, visual access and use of
circular paths, appeared to influence individuals differently,
so would benefit from further research.
Figure 7 .5: The shopping mall in Ankara that was the
subject of Dogu and Erkip's case study
247 ) 
) CAMBRIDGE INTERNATIONAL AS & A LEVEL PSYCHOLOGY: COURSEBOOK
Spatial movement patterns
Shopper behaviour has been researched in different
contexts, and research has shown that the purpose of
the trip and the shopper profile can influence movement
and behaviour patterns. There are different types of
shopping trip that have been identified based on whether
the trip is a big weekly shop, or just popping in for
certain things. There are also different types of shopper
identified: some who have a list and are focused on what
they need, and others who wander up and down aisles
and see what they fancy. The types of trip and the type
of shopper will affect the sort of movement pattern that
is used.
Example study
Gil et al. (2009) examined patterns of shopper
movement and behaviour in a supermarket. They
tracked movements of over 480 shoppers, and
interviewed them after their visit, to produce shopper
profiles. The study is non-experimental because the
researchers did not manipulate any variables. The
researchers were interested in whether store layout has
an impact on shopper behaviours, specifically movement
patterns, shopping duration and interaction with
products. They aimed to identify distinctive movement
patterns and to see if these patterns can be associated
with certain shopper groups.
Shoppers were initially approached to take part in a
survey, and basic information (such as age, gender and
size of group) was recorded. CCTV (video surveillance
often used in shops for security) was used to track
their journey around the shop, using a coloured tag to
248)
identify them. As they left the store, they were given a
more detailed interview. The interview covered a range
of topics, asking the shopper about the purpose of their
trip, their use of a shopping list, satisfaction with their
shopping and the amount of money spent. Participants
were also asked about more general shopping habits
such as the frequency of shopping trips. The CCTV
recordings were processed to extract data on the store
areas visited, the time spent in each area and the type of
product interactions. The researchers concluded that, as
expected, shopper behaviour is strongly affected by the
location of products within the store. Also as expected,
some areas are more popular than others, with milk,
fruit and vegetables, and bread being the busiest and
non-food and baby products being the least busy.
A more interesting result is that it is possible to identify
four distinct patterns of movement around the store:
•
•
•
•
Short trip: a short, simple trip for a few targeted
items, and not necessarily visiting the most popular
products (32 shoppers).
Round trip: moving up and along the top corridor,
then returning along the main corridor with
detours into various aisles (173 shoppers).
Central trip: using the main corridor for entering
and exiting the building, and moving down various
aisles, mostly the top aisles initially then the bottom
aisles on the return (110 shoppers).
Wave trip: linear progression along the main
corridor, zigzagging through the aisles and mostly
exiting near the far end of the store (166 shoppers).
Figure 7.6 shows these four patterns of movement. 
Short trip (32)
Jtt' ...
~~~.~-~-~
Central trip (llO)
Figure 7 .6: Short trip, round trip, central trip, wave trip
There were no significant differences in the types of
people making each type of trip. It instead appears to
represent individual preference.
Of further interest was the identification of five types of
spatial behaviour patterns:
• The Specialist
• focusing on a few products and spending a
lot of time with each product, though not
necessarily resulting in a purchase.
• These shoppers are mainly on 'top-up' or 'nonfood' mission.
• 19 shoppers, 25% males, 58% use baskets, 85%
shop for less than 20 minutes.
7 Consumer psychology
Round trip (173)
\
Wave trip (166)
• The Native
• A long trip visiting relevant aisles, and
interactions are most likely to lead to purchases.
• They are mainly on 'main' or 'top-up' mission.
• 161 shoppers, 98% use a trolley, 90% are
satisfied with their shopping experience.
• The Tourist
• Fast-moving shoppers who don't stray too
far from the entrance and tend to stay on the
main corridor.
• They look more than buy and some are on
'non-food' mission.
• 101 shoppers, 80% have short or medium trips,
35% are of the mature profile, only 28% are
very satisfied with their experience.
249) 
) CAMBRIDGE INTERNATIONAL AS & A LEVEL PSYCHOLOGY: COURSEBOOK
• The Explorer
• _ The longest trip, visiting all aisles in the store
and often visiting places more than once.
• This involves spending a long time with
products and buying a lot and involve a 'main'
shopping mission.
• 67 shoppers, 62% females shopping alone, 87%
take a trolley, 43% have a shopping list (highest
of all categories).
• The Raider
• Involving fast movements and fast decisions,
showing preference for the main corridor but
going where necessary.
• These have the highest proportion of male
shoppers and are on 'top-up' or 'food for
tonight' missions.
• 113 shoppers, 33% male (biggest proportion
of all categories), 100% walking at medium
or fast speed.
Gil et al. concluded that this information about
shopper behaviour could be further investigated
in other stores with other layouts.
RESEARCH METHODS
Dogu and Erkip (2000) used a case study to
find out about factors that affect wayfinding in
a shopping mall. The use of a case study means
that the researchers could gather lots of detailed
information about the shopping mall and this can
give a really good insight into a range of factors.
However, the problems with using a case study
is that it is just focusing on this one shopping
mall, so the results cannot be fully generalised
to other shopping malls, as they are all unique.
Case studies can be criticised for lacking reliability
because they cannot be replicated due to the
unique nature, so there is no way to test if their
results would be found again.
Gil et al. (2009) used a different approach in their
work: by using a non-experimental design where
no variables were manipulated. This means that
they are just gathering data from people's normal
everyday lives. The use of CCTV allowed for
consumers to be tracked, and they also
250)
'
CONTINUED
used interviews to find out about consumers'
experience. The interviews provided information
about the shoppers' intentions and experiences
of the shop that, combined with the CCTV
tracking, allowed the researchers to get a good
understanding of different shopper behaviour.
ISSUES AND DEBATES
The studies carried out by Gil et al. and by Dogu
and Erkip both take a holistic approach in their
research. They both use a range of different
approaches in their investigation in order to
try to gather as full and holistic understanding
as possible. Gil et al., for example, used CCTV
tracking to measure observable behaviour of the
customers in the shop, but then they also used
interviews to understand the customers' attitudes,
thoughts and feelings, making the approach
holistic. Similarly, Dogu and Erkip carried out
a case study on a shopping mall so they could
look in detail at all aspects of the spatial layout,
as well as giving questionnaires to customers
to get an understanding of their attitudes and
feelings about the mall. How could individual
versus situational explanations be applied to
environmental influences on consumer behaviour?"
