topic,content
"• thinking fast and thinking slow/system 1 and system 2 including explanations and examples of each, e.g. Shleifer (2012).

• choice blindness, preferences and defending a choice (exemplified by the following key study). Key study for choice blindness when tasting food items: Hall et al. (2010).

• consumer memory for advertising including how retroactive and proactive interference affect memory, including a study, e.g. Burke and Srull (1988).","Mistakes in decision-making
Thinking fast and thinking slow/System
1 and System 2
Kahneman's (2011) book Thinking, Fast and Slow presents
his 40 years of research into the theory of thinking and
has been summarised and reviewed by Shleifer (2012).
According to Kahneman, there are two different systems
used for thinking: System l and System 2. System
1 thinking corresponds to 'thinking fast', involving
automatic, intuitive, unconscious and effortless thinking.
System 1 thinking relies on associations and heuristics,
rather than on statistical analysis or consideration
of evidence. On the other hand, System 2 thinking
corresponds to 'thinking slow', it is conscious, controlled
and deliberate. System 2 thinking relies on statistical
analysis and requires time and attention so it is costly to
use. Kahneman and Tversky claim that System 1 describes
'normal' decision-making and is the approach most of us
take to making decisions, most of the time. This not only
applies to small and insignificant decisions but also to
bigger decisions such as investments and purchases. System
1 is useful because it is quick and effortless so it allows for
our lives to be easier. Often, System 1 thinking works out
well but because of the lack of deliberate and conscious
tho~ght, sometimes it can lead to errors. This does not
mean that we are incapable of System 2 thought, but that
we don't use it very often. This may be why it is so difficult
to make accurate predictions about decision-making.
KEYWORDS
System 1 thinking: 'thinking fast', involving
automatic, unconscious thinking, which is nonstatistical and uses associations
System 2 thinking: 'thinking slow', involving
conscious controlled thinking, which is deliberate
and costly to use 
An example to demonstrate the difference in System 1
and System 2 thinking comes from one of Kahneman
and Tversky's best-known experiments. In the
experiment, Americans were asked to respond to this
statement: 'Steve is very shy and withdrawn, invariably
helpful but with very little interest in people or in the
world of reality. A meek and tidy soul, he has a need for
order and structure, and a passion for detail.' Is Steve
more likely to be a librarian or a farmer?
The most common response would come from System
1 thinking. Steve is more likely to be a librarian than a
farmer because he sounds more like a librarian than a
farmer. However, this has ignored the facts that there
are at least five times as many farmers in the USA as
there are librarians, and that male librarians in the USA
are even less common. Therefore, a response from the
System 2 approach would be that it is much more likely
that Steve is a farmer, rather than a librarian.
Kahneman claims that adding two and two, completing
the words 'bread and ... ' and driving a car on an empty
road are all examples of System 1 thinking. They require
a quick, intuitive response with little effort, and usually
get the right answer. However, the previous example of
Steve shows that System 1 can sometimes lead to errors.
There are some difficulties when considering System 1 and
System 2 thinking. First, the parameters of these systems
will vary between people. Kahneman uses an example of
calculating 20 x 20 to demonstrate that, for some people
(such as mathematicians) this is a System 1 effortless task,
whereas for others it would rely on System 2, effortful
thinking. Another difficulty with the systems is that we
focus on the errors that tend to occur as a result of System
1 thinking, however, System 2 is not flawless, and can
also lead to errors. Considering the example of 20 x 20,
even using System 2 and spending time and effort on the
calculation, some people will still make an error. Therefore,
if we see an error in thinking or decision-making, it is not
obvious whether the error is due to System 1, System 2
or a combination of the two. A third problem with the
relationship between System 1 and System 2 comes from
the idea that most of the information that is considered
during System 2 comes from System 1. If the full or correct
information is not 'sent' from System 1 to System 2 then
what prompts System 2 to engage? To use the example
of Steve, what would actually trigger someone to engage
System 2 thinking and consider the ratio of male librarians
to farmers? There are many questions that remain
unclear or unanswered in terms of how the two systems
are distinguished from another and how they work with
one another.
7 Consumer psychology
Choice blindness
Key study: Hall et al. (2010)
Hall, L., Johansson, P., Taming, B., Sikstrom, S.,
& Deutgen, T. (2010). Magic at the marketplace:
choice blindness for the taste of jam and the smell
of tea. Cognition, 117(1 ), 54-61.
Context
Choice blindness is an example of an error in decisionmaking. This occurs when someone doesn't notice
the difference between what they have chosen and the
outcome they get. Johansson et al. (2005) investigated
choice blindness by asking participants to select
which of two photos of women's faces they found
most attractive. The photos were then surreptitiously
swapped over, and the participant was asked to defend
their choice and explain why they found their chosen
photo more attractive (while being presented with the
other photo). Participants only noticed that there was
something wrong with their choice in 26% of trials.
If the processing of faces was subject to choice blindness
it is reasonable to expect that the same could be applied
to other visual processing. However, Hall et al. were
interested to discover whether choice blindness extended
beyond human faces and other visual processing. They
were interested in whether choice blindness would apply
to other decision-making, and specifically, would it
apply to consumer decision-making in a real-life setting.
KEYWORD
choice blindness: refers to a person's inability
to notice mismatches between intention and
outcome in a decision
Main theories and explanations
Choice blindness is a complex phenomenon, without a
clear explanation. There has been a great interest in the
importance of implicit or 'non-conscious' influence in
consumer decision-making. One example of an implicit
influence is preference fluency; how easy or difficult the
consumer perceives the choice to be. Another implicit
influence is placebo effect of marketing, where people
tend to believe that a product will be less effective if it is
purchased at a reduced price.
267 > 
) CAMBRIDGE INTERNATIONAL AS & A LEVEL PSYCHOLOGY: COURSEBOOK
As well as these implicit influences, our decision-making
is also affected by explicit influences, in other words
making a decision based on what you actually see and
hear relating to the product itself. Choice blindness
then is interesting because it considers the interaction
between explicit choices (the decision you make initially)
and implicit changes (the surreptitious switching of
your choice). Studying choice blindness allows us to
gain insight into the decision-making processes that
occurred at the time, as well as the extent to which we
are consciously aware of these afterwards.
Aims
The aim was to investigate whether choice blindness
would be shown with consumer decision-making in a
naturalistic setting.
Design
The study was a field experiment, where a tasting venue
was set up at a supermarket. The sample consisted of 180
participants, of which 118 were female, and with an age
range of 16-80 years, at a supermarket in Sweden. This
was opportunity sampling, as participants were asked if
they would like to be involved in a quality control test for
pairs of teas and jams (see Figure 7.16). Each participant
was asked to taste the jam and smell the tea and say which
of each pair they preferred. For each participant either the
jam or the tea condition was manipulated. Half were told
they would receive the chosen tea or jam as a thank you
gift. For each participant, the order of presentation, the
type of manipulation and which jams and teas were used
were randomly allocated.
Figure 7 .16: Participants tasted pairs of jams and chose
their favourite
268)
Experimenter 1 asked the questions, took notes and
managed the recording device, while experimenter
2 conducted the preference test. In the manipulated
condition the participant was presented with the two
jars of jam or tea and asked to sample the first one and
rate how much they liked it on a scale of 1-10. While
they were rating it, experimenter 2 surreptitiously turned
the jar upside down so that now the other sample was
present (this was created by having two jars attached
to each other bottom to bottom, each with a screw on
lid and a paper label covering the join so it looked like
a normal jar). The participant was asked to sample the
other option and again while rating it, experimenter 2
turned it upside down. Participants were now asked to
taste their preferred sample again, defend their choice,
and indicate on a ten-point scale how difficult they
found the decision and how confident they were in their
choice. After the participant had completed the tea
and jam pairing, they were asked if they felt there was
anything odd or unusual about the set up or about the
sampled alternatives. They were then fully debriefed and
had the full aim explained, and were asked again if they
suspected any manipulation.
There were three criteria for detection of the
manipulation: concurrent detection (if the participant
noticed anything unusual immediately after tasting
or smelling the manipulated jam or tea), retrospective
detection (where the participant claimed to have noticed
the deception after the experiment, either before or after
debriefing) and sensory-change detection (where, even
if the participants did not report noticing anything,
they made any comments about the change in taste or
smell after the manipulation). Those with a concurrent
detection completed the taste study but their results
were not included in the results analysis.
Results, findings and conclusions
Only 14.4% of the jam and 13.8% of the tea trials were
detected concurrently, 6.2% of the jam and 6.9% of
the tea trials were detected retrospectively, and 12.4%
of the jam and 11.5% of the tea trials were recorded
as sensory-change detection. In total, 33.3% of the
manipulated jam trials and 32% of the manipulated
tea trials were detected. In contrast to predictions,
those offered the tea as a gift were less likely to detect
any manipulation than those who were not offered a
gift. There were no differences based on incentives for
jam. There were no differences in perceived ease of
distinguishing between the two samples, or confidence in
decision (for tea or jam) between the non-manipulation
trials and the manipulation trials where there was 
no detection. Overall rating for perceived ease of
distinguishing between the two samples, and confidence
rating, was notably high for both jam and tea.
The results supported the main prediction: no more than a
third of manipulation trials were detected by participants.
This shows that, for most trials, participants were blind
to the mismatch between intended and actual outcome
of their choice, and instead believed that the taste or
smell in their final sample matched their initial choice.
Furthermore, in two-thirds of detected trials, participants
didn't react at the time of tasting the manipulated sample,
instead this only happened later, or through an expression
of sensory change. Even for vastly different tastes such as
cinnamon-apple and grapefruit, or smells such as mango
and Pernod (strong aniseed smell), detections were made
in less than half of trials, and no more than one-fifth were
detected concurrently. One aspect that makes the findings
so interesting is that, for non-manipulated trials and for
non-detected manipulated trials the ease of distinguishing
between the two samples scored high on the ten-point
scale (7.3 for jam and 8.0 for tea). This shows that the
non-detection could not just be that participants found
it difficult to tell the samples apart; in fact, they found it
easy to distinguish between the two, but they still could
not detect the manipulation. Finally, although some may
argue that this is a low-stakes decision, those who were
offered the free gift were actually less likely to notice the
manipulation than those who were not offered a gift. This
suggests that choice blindness still remains at a significant
level even when faced with real-world consequences.
Evaluation
Hall et al. used opportunity sampling for their field
experiment. They set up a tasting stall at a supermarket
and asked passers-by to take part in taste-testing. A
strength of opportunity sampling is that it is quick, easy
and convenient. By using whoever happens to be present
it means the researchers don't need to spend time and
resources trying to get a sample of participants, as with
some other methods. Another strength is that there is
likely to be a reasonable spread of people; in the case
of Hall et al. there was an age range of 16-80, and a
mix of men and women. A weakness of opportunity
sampling, however, is that you don't have control over
who the sample will be so you cannot ensure it is fully
representative, or that there are any particular types of
people. The use of pilot testing allowed for the researchers
to use samples of jam and tea that they knew were
easy to distinguish from one another. This is really
important for increasing the validity of the study as we
can be confident that the reason for participants not
7 Consumer psychology
noticing a manipulation was not just that it was hard to
distinguish between the two, but instead that it was due to
choice blindness.
Hall et al.'s research is applicable to real life because
it helps us to understand the role of choice blindness.
Although this was a low-stakes situation, where there were
not any repercussions because of the choice blindness,
it is still an important phenomenon to be aware of.
There could be situations in real life where the stakes are
higher and possible repercussions could be significant
so understanding choice blindness may be relevant. For
example, if somebody was a witness to a crime and they
incorrectly identified a suspect from a set of photos, but
then at trial they defended their choice, despite possible
evidence to the contrary.
Consumer memory for advertising
Advertising is a really important tool for selling
products, but adverts can only work if consumers
remember them. It was first thought that memory
simply fades over time, so if you view an advert one
week you may have forgotten it by the following week
because of the time that has passed (Zielske & Henry,
1980). However, there is much evidence to suggest
that forgetting is not simply due to the passing of time
but that it is more to do with the additional learning
that happens during that time (McGeoch, 1932).
Research shows that people are more likely to be able to
remember information for a period of time if relatively
little learning takes place in the interim (Roediger &
Crowder, 1976). There are two types of interference
that may affect a consumer's memory: retroactive
interference, where new information is learned that
makes it harder to recall earlier information, and
proactive interference, where prior learning can
interfere with a person's ability to learn and recall new
information. Retrieval failure is generally accepted as
KEYWORDS
retroactive interference: this is the process that
occurs when information is hard to recall because
of new information that is learned
proactive interference: this is the process that
occurs when information is hard to recall because
of previous learning that has taken place
retrieval failure: when forgetting occurs due to
either retroactive or proactive interference
269) 
) CAMBRIDGE INTERNATIONAL AS & A LEVEL PSYCHOLOGY: COURSEBOOK
one of the main causes of forgetting: the information
is stored in long-term memory, but the difficulty is
accessing the information again. Information is accessed
by using cues to help find the correct information so, if
more similar information has been learned, it will make
it harder to retrieve the specific memory you are trying
to recall.
McKinney (1935) investigated the role of retroactive
interference in advertising by asking participants to
study one full-page magazine advert. Then half of the
participants were given a rest period while the other
half were given two more adverts to learn (the 'work'
condition). Participants were then given a cued recall
test (where they were given cues to help trigger their
memory) and results showed that those in the rest
condition were more likely to remember the slogan
of the advert (94%) than those in the work condition
(72%), suggesting that the subsequent learning
interfered with the ability to recall the original advert.
Blankenship and Whitely (1941) investigated proactive
interference in advertising by asking participants to
learn either one list of 18 store items and prices, or to
learn the list, after also learning a previous list. Their
results showed that, 48 hours later, those who only had
to learn the list were more likely to recall the items than
those who had also learned a previous list, suggesting it
is the previous information that interfered with the recall
of information.
Example study
Burke and Srull (1988) aimed to discover whether a
consumer's ability to recall distinctive brand informatin
from an advert would be hindered if they subsequently
view an advert for another similar product by another
brand, or for another item by the same brand. They
were also interested in how memory was affected by
the consumer's information processing objective (the
reason why they were looking at the advert). The
researchers reported on three experiments, of which we
will look at the first two. In Experiment I participants
were shown 12 adverts (three of which were the target
adverts they would later be asked to recall, which were
presented near the beginning of the series) and the
information processing objective was manipulated by
asking participants to either decide how likely they
270)
would be to buy that product, or how interesting they
thought the advert was. The 12 adverts were either
similar products by different brands, different products
by the same brand, or a range of different products and
brands. Following viewing, participants were given a
questionnaire about magazine and television viewing
habits as a distractor task and were then given a surprise
recall test where they were given the brand name and
product number of each of the target adverts in turn
and were given 2 minutes to recall any information
about the advert.
3
2
1
KEYWORDS
information processing objective: the reason
for looking at the advert; whether the participant
is looking at the advert to decide on a purchase
or to just rate advert on interest
distractor task: a task given to participants
between learning and recall in a memory task,
to distract them from consciously rehearsing the
learned information
unbroken
Conclusions
■ Varied product context
O Same product context
□ Same brand context
0--------------a
0--------------o o~---~--------~---
Ad interest
value
Brand purchase
likelihood
Judgement task
Figure 7 .17: Results from Burke and Srull's Experiment
1 (1988)
Results showed that participants recalled on average
twice as much when they had been asked to rate
intention to purchase, rather than just rating the advert
on interest, suggesting that purchase intention leads to
closer attention being paid (see Figure 7.17). Results 
also showed that recall was significantly lower for those
who subsequently viewed adverts for similar products or
the same brand ( compared to those who viewed a range
of product adverts). This shows retroactive interference
because the new learning (the adverts that were viewed
after the target advert) interfered with the ability to
recall information about the target advert. However,
information processing objective (whether the consumer
was looking to decide on purchase intent or just rating
the advert on interest) mediated this effect and results
showed that the memory of participants looking at
an advert with a purchase intent was less likely to be
affected by interference from other adverts.
Experiment 2 was designed the same way, but was
intended to investigate proactive interference. As such
in Experiment 2 the target adverts were presented later
in the series, to see if earlier information interfered
with recall of target adverts. Results were similar to
Experiment 1: those rating on purchase intention
recalled more information and those viewing similar
product adverts remembered less information correctly.
However, unlike in Experiment 1, Experiment 2 did
not find that information processing objective had a
significant mediating effect on the influence of similar
product adverts.
RESEARCH METHODS
Burke and Srull's use of laboratory experiments
offers a highly controlled method, giving high
validity and reliability. Validity is high because
extraneous variables are controlled so we can
be confident that any changes in response by
the participants will be due to the change in the
independent variables. For example, adverts were
shown in a specific order, and for the same length
of time so we know that changes in recall can't
be due to some participants viewing the material
for longer. This increases the validity. Reliability is
also high because of the standardised procedure
used. Each participant followed the exact same
procedure in terms of the instructions they were
given, the times, the order, the distractor task
and the cues used in the recall test. Therefore,
because everything was kept the same for each
participant, we can be confident of consistent,
reliable results.
7 Consumer psychology
ISSUES AND DEBATES
Research into the two thinking systems (System
1 and System 2), and the way this impacts our
decision-making can be seen to be deterministic.
The suggestion is that System 1 (thinking fast)
is automatic and unconscious and that we use it
almost all the time. This has been used to explain
why we may make errors in decision-making.
This is deterministic because it suggests that
errors in decision-making happen because we
are automatically using System 1 thinking, rather
than System 2 (thinking slow). However, one
could argue that this explanation ignores free will
and that we are responsible for our own actions
and our own decision-making so if we make an
error that is due to our free will, and our choice
not to engage in System 2 thinking. How could
the idiographic versus nomothetic approach be
applied to research into mistakes in decisionmaking?
Questions
7 Why is a nomothetic approach useful in research
into decision-making strategies?
8 What may be the advantages and disadvantages of
using heuristics when making decisions?
9 Hall et al. recorded three different criteria for
detection of manipulation. Why was this? "
