topic,content
"• diagnostic criteria (ICD-11) of anxiety disorders and fear-related disorders:
– generalised anxiety disorder
– agoraphobia
– specific phobia (blood-injection-injury).

• measures of anxiety and fear-related disorders:
– Generalised Anxiety Disorder assessment (GAD-7).
– the blood injection phobia inventory (BIPI), including a study, e.g. Mas et al. (2010)","6.4 Anxiety disorders and
fear-related disorders
Diagnostic criteria
Anxiety disorders and fear-related disorders are
characterised by excessive fear and anxiety and related
disturbances to behaviour. Symptoms are severe enough
to result in significant distress or to significantly impair
one or more important areas of functioning, such as
family, social or occupational. The distinction between
fear and anxiety is important: fear is a response to
perceived imminent threat in the present, whereas
anxiety is more focused on perceived anticipated threat
in the future. Anxiety and fear-related disorders are
usually differentiated by the specific stimulus that
triggers the fear or anxiety. We will look at the ICD-11
criteria for three such disorders: generalised anxiety
disorder, agoraphobia and specific phobia (bloodinjection-injury (BII)).
Generalised anxiety disorder (see Figure 6.17) is
characterised by marked symptoms of anxiety for
the majority of days, over a period of at least several
months. The anxiety may be a general feeling of
apprehension or may be worry focused on multiple
everyday events such as health, family, finances or work.
Related symptoms such as muscular tension, sleep
disturbance, difficulty concentrating, or irritability may
also present. Symptoms result in significant distress or
significant impairment in one or more important areas
of functioning such as family, social or occupational.
For a diagnosis to be made the symptoms must not
211 ) 
) CAMBRIDGE INTERNATIONAL AS & A LEVEL PSYCHOLOGY: COURSEBOOK
be due to another medical condition or the effect of
substance or medication.
Figure 6.17: Generalised anxiety disorder is characterised
by marked symptoms of anxiety over a period of several
months or more
Agoraphobia is characterised by excessive fear or anxiety
in response to situations where escape might be difficult
or help might not be available, such as using public
transport, being in crowds or being outside the home
alone (see Figure 6.18). The person will be afraid of
having specific negative outcomes, such as panic attacks
or other embarrassing symptoms in a public place.
When possible, these situations are actively avoided and
only entered under specific circumstances or endured
with extreme distress. The symptoms persist for several
months and are severe enough to result in significant
distress or significant impairment to one or more
important areas of functioning.
Figure 6.18: Agoraphobia involves excessive fear or
anxiety such as when in a crowded place
212 )
Specific phobia (BII) is characterised by excessive
fear or anxiety that occurs consistently when exposed
to, or in anticipation of, a specific stimulus: in this
case, the exposure to or anticipation of the sight of
blood, injection or injury. The fear or anxiety will be
disproportionate to the actual danger and the phobic
stimulus will be avoided where possible or endured with
intense fear or anxiety. The symptoms persist for several
months and are severe enough to result in significant
distress or significant impairment to one or more
important areas of functioning.
Measures
The Generalised Anxiety Disorder 7 (GAD-7)
Questionnaire is a screening test often used to enable
further referral to a psychiatrist or counsellor. It has
seven items that measure the severity of anxiety. These
include 'Feeling nervous, anxious or on edge', 'Being so
restless that it is hard to sit still' and 'Feeling afraid as
if something awful might happen'. Similar to the Blood
Injection Phobia Inventory (BIPI), individuals are
asked to provide a score between O and 3 for each item;
however, in this test the scores refer to the frequency of
occurrence of symptoms (0 = not at all, 1 = several days,
2 = more than half the days and 3 = nearly every day).
This tool is typically used by general practitioners and
in primary care settings rather than by specialists. As
such, it can be described as a screening tool, useful for
recommending further referral rather than providing the
level of detail needed for a formal diagnosis.
The Blood Injection Phobia Inventory (BIPI)
The Blood Injection Phobia [nventory (BIPI) is a way of
measuring this specific phobia. The self-report measure
lists 18 possible situations involving blood and injections
(see Table 6.4 for an example). For each situation the
individual is asked to evaluate different reactions they
might experience for that situation. These include
KEYWORDS
psychiatrist: a doctor with specialised medical
training to deal with the diagnosis and treatment
of disorders. (Most psychologists are not
medical doctors)
Blood Injection Phobia Inventory (BIPI): a selfreport measure of B11 phobia 
cognitive, physiological and behavioural responses. They
are then asked to rate on a scale of 0-3 the frequency
of each symptom (0 = never, 1 = sometimes, 2 = almost
always, 3 = always).
Example situation Example cognitive
response (rated 0-3)
When I see blood on I don't think I will
my arm or finger after be able to bear
pricking myself with the situation
a needle I think I am going
to faint
I think that something
bad is going to happen
to me
Table 6.4: Extract from the Blood Injection Phobia
Inventory (BIPI) (adapted from Mas et al., 2010)
Example study
Mas et al. (2010) carried out research to see whether
the BIPI could discriminate between those diagnosed
with BII phobia and those who were not. They also
wanted to investigate whether blood phobia was a onedimensional construct, or whether it was influenced by
a range of stimuli (such as other medical procedures)
and responses (cognitive, biological and behavioural).
Finally, the research aimed to find out whether the
BIPI could identify a change in people with the phobia,
as a result of therapy. They studied 39 participants
diagnosed with BII phobia and a control group matched
on age and gender. As well as the BIPI, participants
completed the Fear Questionnaire (FQ; Marks &
Matthews, 1979) designed to measure agoraphobic fear,
social anxiety and blood-injection-injury phobia.
Results showed that the BIPI had excellent reliability
and internal consistency as well as good concurrent
validity with the subscale of blood phobia of the FQ.
The BIPI also clearly discriminated between those
diagnosed with blood-injury-injection phobia and
those who were not. Finally, the BIPI was found to be
a sensitive tool in identifying therapeutic improvement.
Participants completed the BIPI before and after
undergoing treatment for their phobia and the BIPI
scores indicated a notable reduction in the severity of
the phobia following treatment.
6 Clinical psychology
RESEARCH METHODS
In this section, we have considered two
assessment tools for measuring symptoms of
anxiety and related disorders: the BIPI and the
GAD-7. Both the GAD-7 and the BIPI have been
shown to have good concurrent validity with
other measures, and thus are valid and reliable
instruments for assessing anxiety and blood
phobia respectively (Mas et al., 2010, Spitzer
et al., 2006). However, both measures rely on
the accuracy of the individual's self-reporting of
symptoms. If a person is having a particularly
'bad' day (perhaps they have accidentally cut their
finger that morning), then their BIPI score might
be distorted by this.
Both measurement tools described here can be
considered to be psychometric assessments.
This means they analyse one dimension of a
person's thinking, behaviour and emotions,
e.g. towards blood in the case of the BIPI. This
type of assessment can be controversial; it
relies on a single quantitative measurement of
what is actually a complex and all-consuming
lived experience for individual sufferers. Some
psychologists might feel that these assessments
alone do not tell us enough about what it is like to
have a specific phobia, and how symptoms may
change over time and with treatment.
ISSUES AND DEBATES
Cultural differences can be considered in relation
to methods of measuring psychological disorders.
Many psychological disorders have been found
to have slightly different symptoms for people in
different cultures. There is a concern about the
validity of using the same diagnostic criteria for
people across all cultures. Blood-injury-injection
phobia is a particular example where there may be
cultural differences in people's experiences. The
phobia relates mainly to blood tests and other
similar procedures such as injections, so it may
213 ) 
) CAMBRIDGE INTERNATIONAL AS & A LEVEL PSYCHOLOGY: COURSEBOOK
CONTINUED
not have as much relevance in some non-Western
cultures where medical procedures such as this are
rare or not present at all. Similarly, symptoms of
general anxiety disorder and agoraphobia will be
very different for those in some cultures, where,
for example, public transport or busy shopping
centres are not part of everyday life. It is not to say
that these disorders may not be present across all
cultures but that the specific ways they present
may differ between cultures so the measures used
may need to be amended to account for this. "
"• biological explanation: genetic, including a study, e.g. Öst (1992).

• psychological explanations:
– behavioural (classical conditioning), including a study, e.g. Watson and Rayner (1920) ‘Little Albert’
– psychodynamic, including a study, e.g. Freud (1909) ‘Little Hans’.","Explanations
Biological
Genetic
The genetic explanation suggests that we are born
prepared to fear certain objects. In other words, there
are particular stimuli in the environment that may pose
a threat to survival that we are more genetically set up
to avoid. This is transmitted in our DNA through the
generations to help our survival.
Example study
Ost (1992) carried out a study included 81 individuals
with blood phobia and 59 individuals with injection
phobia. These were also compared with a sample
of other participants who had been diagnosed with
different specific phobias, such as animal, dental and
claustrophobia (fear of small spaces). Participants
underwent a screening interview with a clinician and
completed a self-report questionnaire on the history
and nature of their phobia.This included discussing the
impact the phobia had on their normal lives, as well as
giving ratings to particular situations that might trigger
a fearful response.
Participants also underwent a behavioural test. Those
with blood phobia were shown a 30-minute silent colour
video of surgery being performed. They were told not
to close their eyes but to try to watch for as long as they
felt they could. The experimenter tracked gaze direction
and if participants looked away or stopped the video
using a remote control, the test would be terminated.
The injection phobic test was 'live' and involved 20
steps, from the individual's fingertip being cleaned, to
214 )
having a fingertip prick performed on them. Each step
was described to the subjects, who had to say whether
or not it was OK to perform. If they said 'no' the
test ended.
The measures included a score relating to the percentage
of maximal performance (e.g. how long they watched
the video), the experimenter's rating of the patient's
fainting behaviour (0 = no fainting and 4 = fainting),
and a self-rating of anxiety (0 = not at all anxious and
10 = extremely anxious). Participants also completed a
questionnaire on their thoughts during the test and had
their blood pressure and heart rate monitored. This is
because the fainting associated with these phobias has
been found to be related to changes in blood pressure
and heart rate.
The family histories of participants revealed that around
50% of those with blood phobia had one or more
parents who also had blood phobia. Similarly, for those
with injection phobia, 27% had at least one parent who
has also had injection phobia. Around 21 % of those
with blood phobia also reported having at least one
sibling who shared the disorder. Another key finding of
this study is that a high proportion of the participants
with blood phobia and injection phobia had a history of
fainting when exposed to their respective phobic stimuli
(70% of those with blood phobia and 56% of those with
injection phobia). These results are much higher than
those participants with other specific phobias or anxiety.
Ost concluded that there seemed to be a strong genetic
link for these phobias, which are more likely than
other phobias to produce a strong physiological
response (fainting).
Psychological
Behavioural including classical and operant
conditioning
One behavioural explanation for phobias is based on
classical conditioning. An individual may develop a
phobia of a harmless stimulus if it is paired with a
frightening experience. For example, a person might
develop agoraphobia following an assault or mugging
(being a victim of robbery) in public.
In what is now thought to be a controversial study,
Watson and Rayner (1920) used the principles of
classical conditioning to create a phobia in a young
boy. A normal, healthy 9-month-old infant known as
'Little Albert' was the participant in their case study
(see Figure 6.19). 
Figure 6.19: Little Albert was the subject of Watson and
Rayner's case study into classical conditioning and phobias
Prior to the conditioning, he was shown a range of
different stimuli. These included a white rat, a rabbit,
a dog, a monkey, masks with and without hair, cotton
wool, burning newspapers, etc. He reacted normally
and neutrally throughout with no outward signs of
fear. The white rat was chosen as the neutral stimulus
(NS). They also placed a metal bar above and behind
Albert's head and struck it loudly with a hammer. This
was the unconditioned stimulus (UCS) as it produced an
unconditioned response of fear (UCR) in the boy.
The next phase was the conditioning (see Table 6.5).
When Albert was shown the rat, he began to reach for it,
but just as his hand touched the animal the researchers
made a loud noise by striking a hammer against a metal
bar just behind his head. Understandably this made the
Before conditioning unconditioned stimulus (UCS)
Loud noise of metal bar
During conditioning neutral stimulus + unconditioned
stimulus
(NS) + (UCS)
White rat+ loud noise
After conditioning conditioned stimulus (CS)
White rat or similar animal/item
Table 6.5: Stages of Little Albert's classical conditioning
6 Clinical psychology
infant very distressed. Watson and Rayner repeatedly
paired the loud noise with presentation of the white
rat over several trials one week after the initial trial.
Eventually Albert only had to see the rat and he began to
show a fearful response ( crying, trying to move away from
it). The white rat had become a conditioned stimulus
(CS), producing a conditioned response (CR) of fear.
The researchers wanted to see if Albert's fear of the rat
was generalised to other similar-looking animals or items.
When presented with a rabbit he also had a similarly
distressed reaction. These results suggested that fear
could indeed be learned through classical conditioning.
We have seen how classical conditioning can explain
how a phobia can begin. To understand how phobias
can be maintained, however, we need to look at
another form of conditioning: operant conditioning.
Operant conditioning is based on the principle
of learning through consequences. So, if you are
punished for a behaviour, you will be less likely to
repeat the behaviour. However, if you carry out a
behaviour and you get a reward, you will be likely to
repeat the behaviour again (reinforcement). Negative
reinforcement is an important feature of operant
conditioning and it is this which can best explain how
phobias persist. Negative reinforcement is the increased
KEYWORD
negative reinforcement: an increased likelihood
of repeating the behaviour, due to the removal of
something negative or unpleasant
➔ unconditioned response (UCR)
Fearful crying and avoidance
➔ unconditioned response (UCR)
Fearful crying and avoidance
➔ conditioned response (CR)
Fearful crying and avoidance
215 ) 
) CAMBRIDGE INTERNATIONAL AS & A LEVEL PSYCHOLOGY: COURSEBOOK
likelihood of a behaviour being repeated, due to the
removal of something negative or unpleasant. In terms
of a phobia, the avoidance of the phobic stimulus
reduces the fear, so it is therefore rewarding, and the
avoidant behaviour will be repeated. This leads to a
continuation of the phobia because, by avoiding the
stimulus you are not allowing yourself the opportunity
to see that there is little to fear. For example, an
individual develops a phobia of ducks after being
chased by a duck (thus forming an association
through classical conditioning). As a result, the person
avoids parks, farms, etc. where ducks are most likely
to be encountered, so that they can avoid the fear
they would feel in the presence of ducks (negative
reinforcement). However, most ducks are not aggressive
or scary so meeting other ducks may act as a way of
counterconditioning and overcoming the phobia. So,
although rewarding in the short-term, the avoidance
behaviour actually allows the phobia to persist.
KEYWORD
counterconditioning: replacing a conditioned
response, such as fear, with another response,
such as a feeling of calm
Psychodynamic
Freud suggested that anxiety and fear can result from
the impulses of the id, usually when it is being denied
or repressed. Phobias are one way this internal conflict
can manifest in human behaviour. According to Freud's
theory of psychosexual stages, such sources of conflict
are common at different times in our development. The
phobic object comes to symbolise the conflict typical of
the stage.
Example study
Freud (1909) offered an account of a boy who was
suffering from a phobia of horses and a range of other
symptoms to illustrate the Oedipus complex. Little
Hans was a five-year-old Austrian boy whose father had
referred the case to Freud and provided most of the case
detail; Hans met Freud no more than twice during the
period of the study (see Figure 6.20).
When he was three, Little Hans had developed an
intense interest in his penis. He frequently played with
himself, which angered his mother who threatened to
cut it off. This upset the boy and he developed a fear
of castration. Around this time, Hans' younger sister
was born, and his mother was separated from him in
hospital. He also witnessed an upsetting incident where
a horse fell and died in the street.
Quite soon after this time, Little Hans' horse phobia
emerged. He was particularly worried that he would be
bitten by a white horse.
Figure 6.20: Little Hans' phobia of horses was the subject
of a case study by Freud
Hans' father felt this concern was related to horses'
large penises. Conflict began to emerge between Hans
and his father, who had begun denying him the chance
to get into his parents' bed in the mornings to sit with
his mother. Hans' phobia lessened as he reached the
age of five. His father reported Hans had experienced
two notable fantasies at this time. One was that he
had several children of his own with his mother and
imagined that his father was in fact his grandfather. He
also fantasised that a plumber had come and removed
his penis and replaced it with a new, larger one.
Freud felt that the object of fear, the horse, represented
Hans' father. Hans was particularly afraid of white
horses with black nosebands, which symbolised his
moustached father. The anxiety Little Hans experienced
was related to his castration fear from his mother's
threat and the banishment of Hans from his parents'
bed. Freud argued that the Oedipus complex was further
supported by the two fantasies, which represented the
dynamic of the three-way relationship between Little
Hans and his parents. 
Ethical considerations should be taken into account
particularly when looking at Watson and Rayner's
study into Little Albert. The fact that Watson and
Rayner's research was carried out on a child means
that ethical issues are particularly important. It
could be argued that Watson and Rayner did not
protect Little Albert from harm. Little Albert was
deliberately and repeatedly exposed to fearful
experiences to create phobias, which would
have lasting damage. However, it is important to
remember that Little Albert's parents consented
for him to take part in the research, with a full
understanding of what was going to take place.
Both the studies by Watson and Rayner (1920)
and Freud (1909) were case studies. This means
we cannot reasonably generalise about the
acquisition of phobias from Little Albert's or
Little Hans' experiences alone. However, Watson
and Rayner conducted a number of trials using
different stimuli to check whether Albert was a
particularly fearful boy and controlled for any
changes that occurred during the study. As
Albert appeared healthy and confident, it may
well be that phobias could be acquired by other
children in the same way. Freud's study lacked
objectivity as he was a friend of Hans' father, who
also provided him with the case study detail. This
research lacks validity as it may be subject to bias
in an attempt to fit Freud's existing theories about
the subconscious and psychosexual stages.
In comparison, the research by Ost could be
considered more objective, because it used
standardised behavioural tests and interviews with
larger groups of participants. His findings could
be generalised more easily and had better levels
of control. However, the study was cross-sectional
and did not consider the different participant's
experiences in depth.
Freud's case study of Little Hans takes into
account Hans' fears, dreams, conversations and
fantasies over a number of years to trace the
origin and resolution of his horse phobia. Use
of longitudinal research in this way can build an
in-depth picture of a participant's experience,
which can help us to get a better understanding
of causal factors in specific phenomenon, such as
the development of phobias.
6 Clinical psychology
ISSUES AND DEBATES
All the explanations we have seen in this section
can be seen to be deterministic. The genetic
explanation suggests that if you have a close
family member with blood phobia you are at
significant risk of developing it yourself. If a
condition is thought to be genetic it suggests that
free will is not involved and that an inheritance of
a certain gene, or combination of genes, will make
you more likely to develop the disorder.
Similarly, the behaviourist and psychodynamic
explanations are also deterministic. The
behaviourist approach suggests that if you are
subject to conditioning where an association
is made between a feared stimulus and a
neutral stimulus, a phobia will develop. The
psychodynamic approach proposes that anxiety
and fear-related disorders develop due to
unresolved conflicts during childhood. Again, this
is deterministic as the suggestion is that if you
experience this unresolved conflict, anxiety or fear
will develop and there is little that can be done to
overcome or avoid it.
It is important to consider that no gene has been
found to be anywhere near 100% predictive of
anxiety or fear-related disorder, that not everyone
who experiences a fearful situation then develops
a phobia and that evidence for unresolved
conflicts during childhood is unscientific and
retrospective so cannot be used to make
predictions or determine the onset of anxiety or
fear-related disorder."
